{
  "schema": "apex-performance-profile/1.0.0",
  "schema_file": "docs/task007e/e2/performance_profile.schema.json",
  "profile_id": "apex_performance_synthetic_v1",
  "designation": "PROPOSED SYNTHETIC APEX PERFORMANCE PROFILE \u2014 AWAITING PRIMARY ACCEPTANCE",
  "status": "WORK_COMPLETE_PENDING_REVIEW",
  "flags": {
    "tested_synthetic_formulation": true,
    "proposed_performance_designation": true,
    "formal_verification_pending": true,
    "primary_acceptance_pending": true,
    "hardware_certification_available": false,
    "frozen": false,
    "runtime_auto_load": false,
    "production_default_changed": false
  },
  "profile": {
    "architecture": "A",
    "predictor": "A_legacy",
    "coordinates": {
      "state_order": [
        "vx",
        "vy",
        "r",
        "e_psi",
        "s_abs",
        "e_y"
      ],
      "state_units": [
        "m/s",
        "m/s",
        "rad/s",
        "rad",
        "m",
        "m"
      ],
      "control_order": [
        "delta",
        "a_cmd"
      ],
      "control_units": [
        "rad",
        "m/s^2"
      ],
      "control_semantics": "delta is front steering angle; a_cmd=Fx_total/m; dynamic dvx/dt=a_cmd+r*vy",
      "frame": "world x/y in metres; headings radians counterclockwise; body vx forward, vy left, yaw r counterclockwise",
      "frenet": "e_y left-positive; e_psi=body heading minus centerline tangent; s_abs nonnegative unwrapped centerline arc progress; track lookup s_abs modulo length",
      "world_reconstruction": "x=x_center-e_y*sin(psi_center); y=y_center+e_y*cos(psi_center); psi=wrap(psi_center+e_psi)",
      "angle_convention": "(-pi,pi]; tracking/handoff residuals wrapped; NLP heading locally unwrapped for smooth derivatives"
    },
    "vehicle": {
      "file": {
        "path": "configs/vehicles/synthetic_dynamic_test_vehicle.yaml",
        "sha256": "df1b853d21a1d3efaf858f7e58401151f2c5237793c40e16bb4189ed651f9cf3"
      },
      "parameters": {
        "name": "synthetic_dynamic_test_vehicle",
        "mass": 2.0,
        "yaw_inertia": 0.025,
        "wheelbase": 0.3,
        "lf": 0.15,
        "lr": 0.15,
        "cg_height": 0.04,
        "front_cornering_stiffness": 45.0,
        "rear_cornering_stiffness": 45.0,
        "tire_road_friction_coefficient": 1.0,
        "maximum_steering_angle": 0.4,
        "maximum_acceleration": 2.0,
        "maximum_braking_deceleration": 3.0,
        "maximum_speed": 6.0,
        "vehicle_width": null,
        "vehicle_length": null,
        "maximum_steering_rate": null
      },
      "parameter_units": {
        "name": "identifier",
        "mass": "kg",
        "yaw_inertia": "kg*m^2",
        "wheelbase": "m",
        "lf": "m",
        "lr": "m",
        "cg_height": "m",
        "vehicle_width": "m",
        "vehicle_length": "m",
        "front_cornering_stiffness": "N/rad per axle",
        "rear_cornering_stiffness": "N/rad per axle",
        "tire_road_friction_coefficient": "1",
        "maximum_steering_angle": "rad",
        "maximum_steering_rate": "rad/s",
        "maximum_acceleration": "m/s^2",
        "maximum_braking_deceleration": "m/s^2 positive magnitude",
        "maximum_speed": "m/s"
      },
      "identification": "synthetic validation parameters; not physically identified",
      "unknown_fields": [
        "vehicle_width",
        "vehicle_length",
        "maximum_steering_rate"
      ],
      "rate_source": "1 rad/s from MPCConfig/TrackerConfig; fallback receives a replaced parameter object; YAML rate remains unknown"
    },
    "models": {
      "plant": "apex.models.vehicle.dynamic_bicycle.DynamicBicycle (NumPy)",
      "prediction": "apex.control.mpc.symbolic_model.SymbolicBicycle (independent CasADi transcription)",
      "tire_physics": {
        "model": "smooth_combined_grip",
        "longitudinal_allocation": "normal_load_proportional"
      },
      "gravity_m_s2": 9.81,
      "plant_integrator": "existing RK4; all stages and final state checked; physical step split at events, at most 0.005 s",
      "nmpc_integrator": "existing symbolic RK4; 4 substeps of 0.025 s per interval; exogenous preview curvature held per interval",
      "geometry": "plant resamples track geometry at derivative states; predictor uses curvature sampled at each prediction segment start",
      "no_new_vehicle_model": true
    },
    "planning": {
      "package": "configs/planning/task007b/gamma_2p000",
      "gamma": 2.0,
      "track": "synthetic_grand_prix_v1",
      "track_length_m": 154.76345492731022,
      "files": [
        {
          "path": "configs/planning/task007b/gamma_2p000/planning_manifest.json",
          "sha256": "5e7bccf1a300fb6737fc6b6b6e0c9aa921c110b11ffc5762a73f57f830a8660c"
        },
        {
          "path": "configs/planning/task007b/gamma_2p000/planning_reference.csv",
          "sha256": "6206e18ce3cb105d58d0923564336e28c00ec44aee3fd8a06ff7a37bcf84e2df"
        },
        {
          "path": "configs/planning/task007b/gamma_2p000/planning_validation.json",
          "sha256": "279582d2dcf37fdf4008ddc7f926109ef3d730a0e64c188d7003755d08871fa7"
        },
        {
          "path": "configs/planning/task007b/gamma_2p000/speed_polynomial.json",
          "sha256": "f335e78fc6c735c952f49078077a573ee989dd2be71497e90451e34a79f2c7ea"
        },
        {
          "path": "configs/planning/task007b/gamma_2p000/track_source.json",
          "sha256": "5f4d1734d7fec7de56d346e8f90bf272a3de9c05ac42f76cd49004e7f9183e55"
        }
      ],
      "loader": "PlanningReference(..., feasibility_policy=\"advisory\")",
      "interpolation": "periodic cubic geometry with serialized speed polynomial; no online reference regeneration",
      "preview": "11 rows: track curvature,left width,right width,v_ref,vy_ref,r_ref,delta_ff,e_y_ref,e_psi_ref,kappa_ref,a_ref",
      "pseudo_reference": "vy_ref=0; r_ref=v_ref*kappa_ref; delta_ff=atan(wheelbase*kappa_ref); a_ref=0 because absent from this package",
      "nominal_progress": "s[k+1]=s[k]+dt*v_ref*cos(e_psi_ref)/(1-kappa_track*e_y_ref), independent of decision variables",
      "reference_margin_m": 0.08,
      "warning_policy": "advisory feasibility warnings are retained, not a guarantee of racing-reference dynamic realizability",
      "track_half_widths_m": {
        "left": 0.55,
        "right": 0.55
      },
      "geometry_construction": "ClosedTrack.from_waypoints; periodic cubic chord parameter, numerically integrated arc length and inverse queries; constructor source bound by inventory"
    },
    "nmpc": {
      "configuration": {
        "tire_physics": {
          "model": "smooth_combined_grip",
          "longitudinal_allocation": "normal_load_proportional"
        },
        "costs": {
          "lateral": 2,
          "dynamic": 1.0,
          "speed": 1.0,
          "control": 1.0,
          "rate": 1.0,
          "terminal": 1.0,
          "alpha_vy": 1.0,
          "alpha_r": 1.0
        },
        "horizon": 8,
        "dt": 0.1,
        "substeps": 4,
        "steering_rate": 1.0,
        "minimum_speed": 0.5,
        "denominator_margin": 0.01,
        "minimum_axle_load": 1e-06,
        "tracker_margin": 0.08,
        "racing_reference": true,
        "progress_weight": 0
      },
      "horizon_seconds": 0.8,
      "control_parameterization": "full N-stage piecewise-constant two-input sequence; no separate shortened control-horizon parameter or move blocking",
      "decision_dimensions": {
        "states": 54,
        "controls": 16,
        "slacks": 18,
        "total": 88,
        "shooting_equalities": 54
      },
      "stage_cost": {
        "tracking_order": [
          "vx",
          "vy",
          "r",
          "e_psi",
          "e_y"
        ],
        "Q_diagonal": [
          4,
          4,
          1,
          200,
          200
        ],
        "R_diagonal": [
          25,
          1
        ],
        "W_diagonal": [
          1,
          0.1
        ],
        "Q_excludes_progress": true,
        "input_reference": [
          "delta_ff",
          "a_ref"
        ],
        "increment": "u[k]-u[k-1], with predicted preceding command at k=0; no division by dt",
        "sum_scaling": "unweighted stage sum, no dt multiplier",
        "lambda_s": 0,
        "alpha_vy": 1,
        "alpha_r": 1
      },
      "terminal": {
        "policy": "terminal multiplier times lateral DARE quadratic plus speed error weight 4; no terminal set or terminal equality",
        "multiplier": 1.0,
        "lateral_order": [
          "e_y",
          "e_psi",
          "vy",
          "r"
        ],
        "design_dt_s": 0.01,
        "speed_nodes_m_s": [
          1,
          2,
          3
        ],
        "schedule": "linear interpolation of P entries; clamp terminal preview speed to [1,3]",
        "design_Q_diagonal": [
          99.99999999999999,
          99.99999999999999,
          4.0,
          1.0
        ],
        "design_R_diagonal": [
          24.999999999999996
        ],
        "speed_error_weight": 4,
        "alpha_vy": 1,
        "alpha_r": 1,
        "lateral_scale_2_does_not_rescale_terminal": true,
        "design_weights_definition": "1 / DesignScales**2; stored values retain binary floating evaluation; conceptually diag(100,100,4,1), R=25"
      },
      "constraints": {
        "vx_m_s": [
          0.5,
          6.0
        ],
        "s_abs_min_m": 0.0,
        "denominator_min": 0.01,
        "minimum_axle_load_N": 1e-06,
        "control_box": [
          [
            -0.4,
            0.4
          ],
          [
            -3,
            2
          ]
        ],
        "control_box_order": [
          "delta",
          "a_cmd"
        ],
        "steering_rate_rad_s": 1.0,
        "steering_increment_max_per_stage_rad": 0.1,
        "longitudinal_fraction_bound": 0.999999,
        "box_tightening": "also grip and minimum axle-load bounds; under this fixture they do not narrow [-3,2]",